{
  "schema": "motionjson.object_motion.v0.1",
  "objectId": "object_0",
  "fps": 12.0,
  "motion": [
    {
      "frame": 1,
      "sourceFrameIndex": 0,
      "t": 0.0,
      "visible": true,
      "x": 29,
      "y": 129,
      "w": 103,
      "h": 103,
      "scale": 1.0,
      "rotation": 0.0,
      "opacity": 1.0,
      "anchor": [
        51.196,
        50.779
      ],
      "asset": "objects/object_0/cutouts/cutout_000001.png",
      "mask": "masks/object_0/mask_000001.png",
      "centroid": [
        80.1964954023843,
        179.77891788732742
      ],
      "sprite": {
        "x": 0,
        "y": 0,
        "w": 103,
        "h": 103
      }
    },
    {
      "frame": 2,
      "sourceFrameIndex": 2,
      "t": 0.083333,
      "visible": true,
      "x": 39,
      "y": 138,
      "w": 102,
      "h": 103,
      "scale": 1.0,
      "rotation": 0.0,
      "opacity": 1.0,
      "anchor": [
        51.021,
        50.9
      ],
      "asset": "objects/object_0/cutouts/cutout_000002.png",
      "mask": "masks/object_0/mask_000002.png",
      "centroid": [
        90.02133652384157,
        188.89954884219446
      ],
      "sprite": {
        "x": 103,
        "y": 0,
        "w": 102,
        "h": 103
      }
    },
    {
      "frame": 3,
      "sourceFrameIndex": 4,
      "t": 0.166667,
      "visible": true,
      "x": 49,
      "y": 148,
      "w": 102,
      "h": 103,
      "scale": 1.0,
      "rotation": 0.0,
      "opacity": 1.0,
      "anchor": [
        50.627,
        51.127
      ],
      "asset": "objects/object_0/cutouts/cutout_000003.png",
      "mask": "masks/object_0/mask_000003.png",
      "centroid": [
        99.62699741287476,
        199.12697204890173
      ],
      "sprite": {
        "x": 206,
        "y": 0,
        "w": 102,
        "h": 103
      }
    },
    {
      "frame": 4,
      "sourceFrameIndex": 6,
      "t": 0.25,
      "visible": true,
      "x": 60,
      "y": 157,
      "w": 100,
      "h": 102,
      "scale": 1.0,
      "rotation": 0.0,
      "opacity": 1.0,
      "anchor": [
        50.173,
        51.079
      ],
      "asset": "objects/object_0/cutouts/cutout_000004.png",
      "mask": "masks/object_0/mask_000004.png",
      "centroid": [
        110.17317079404022,
        208.07907178818778
      ],
      "sprite": {
        "x": 309,
        "y": 0,
        "w": 100,
        "h": 102
      }
    },
    {
      "frame": 5,
      "sourceFrameIndex": 8,
      "t": 0.333333,
      "visible": true,
      "x": 69,
      "y": 164,
      "w": 103,
      "h": 103,
      "scale": 1.0,
      "rotation": 0.0,
      "opacity": 1.0,
      "anchor": [
        50.784,
        50.729
      ],
      "asset": "objects/object_0/cutouts/cutout_000005.png",
      "mask": "masks/object_0/mask_000005.png",
      "centroid": [
        119.7844527363184,
        214.72925373134328
      ],
      "sprite": {
        "x": 412,
        "y": 0,
        "w": 103,
        "h": 103
      }
    },
    {
      "frame": 6,
      "sourceFrameIndex": 10,
      "t": 0.416667,
      "visible": true,
      "x": 79,
      "y": 172,
      "w": 102,
      "h": 102,
      "scale": 1.0,
      "rotation": 0.0,
      "opacity": 1.0,
      "anchor": [
        51.168,
        49.903
      ],
      "asset": "objects/object_0/cutouts/cutout_000006.png",
      "mask": "masks/object_0/mask_000006.png",
      "centroid": [
        130.1681437898761,
        221.9033291129813
      ],
      "sprite": {
        "x": 515,
        "y": 0,
        "w": 102,
        "h": 102
      }
    },
    {
      "frame": 7,
      "sourceFrameIndex": 12,
      "t": 0.5,
      "visible": true,
      "x": 90,
      "y": 178,
      "w": 102,
      "h": 100,
      "scale": 1.0,
      "rotation": 0.0,
      "opacity": 1.0,
      "anchor": [
        50.146,
        48.429
      ],
      "asset": "objects/object_0/cutouts/cutout_000007.png",
      "mask": "masks/object_0/mask_000007.png",
      "centroid": [
        140.14577633168182,
        226.42852917252088
      ],
      "sprite": {
        "x": 618,
        "y": 0,
        "w": 102,
        "h": 100
      }
    },
    {
      "frame": 8,
      "sourceFrameIndex": 14,
      "t": 0.583333,
      "visible": true,
      "x": 99,
      "y": 178,
      "w": 103,
      "h": 103,
      "scale": 1.0,
      "rotation": 0.0,
      "opacity": 1.0,
      "anchor": [
        51.17,
        51.295
      ],
      "asset": "objects/object_0/cutouts/cutout_000008.png",
      "mask": "masks/object_0/mask_000008.png",
      "centroid": [
        150.16990496042084,
        229.29467232437528
      ],
      "sprite": {
        "x": 0,
        "y": 103,
        "w": 103,
        "h": 103
      }
    },
    {
      "frame": 9,
      "sourceFrameIndex": 16,
      "t": 0.666667,
      "visible": true,
      "x": 110,
      "y": 178,
      "w": 102,
      "h": 103,
      "scale": 1.0,
      "rotation": 0.0,
      "opacity": 1.0,
      "anchor": [
        50.214,
        51.123
      ],
      "asset": "objects/object_0/cutouts/cutout_000009.png",
      "mask": "masks/object_0/mask_000009.png",
      "centroid": [
        160.21435720362308,
        229.12337987289195
      ],
      "sprite": {
        "x": 103,
        "y": 103,
        "w": 102,
        "h": 103
      }
    },
    {
      "frame": 10,
      "sourceFrameIndex": 18,
      "t": 0.75,
      "visible": true,
      "x": 120,
      "y": 177,
      "w": 102,
      "h": 103,
      "scale": 1.0,
      "rotation": 0.0,
      "opacity": 1.0,
      "anchor": [
        50.332,
        51.261
      ],
      "asset": "objects/object_0/cutouts/cutout_000010.png",
      "mask": "masks/object_0/mask_000010.png",
      "centroid": [
        170.33230188679246,
        228.26080503144652
      ],
      "sprite": {
        "x": 206,
        "y": 103,
        "w": 102,
        "h": 103
      }
    },
    {
      "frame": 11,
      "sourceFrameIndex": 20,
      "t": 0.833333,
      "visible": true,
      "x": 131,
      "y": 174,
      "w": 102,
      "h": 103,
      "scale": 1.0,
      "rotation": 0.0,
      "opacity": 1.0,
      "anchor": [
        50.167,
        51.196
      ],
      "asset": "objects/object_0/cutouts/cutout_000011.png",
      "mask": "masks/object_0/mask_000011.png",
      "centroid": [
        181.16721178469103,
        225.19629319743413
      ],
      "sprite": {
        "x": 309,
        "y": 103,
        "w": 102,
        "h": 103
      }
    },
    {
      "frame": 12,
      "sourceFrameIndex": 22,
      "t": 0.916667,
      "visible": true,
      "x": 140,
      "y": 169,
      "w": 102,
      "h": 103,
      "scale": 1.0,
      "rotation": 0.0,
      "opacity": 1.0,
      "anchor": [
        50.593,
        50.83
      ],
      "asset": "objects/object_0/cutouts/cutout_000012.png",
      "mask": "masks/object_0/mask_000012.png",
      "centroid": [
        190.59320677321728,
        219.8301943423126
      ],
      "sprite": {
        "x": 412,
        "y": 103,
        "w": 102,
        "h": 103
      }
    },
    {
      "frame": 13,
      "sourceFrameIndex": 24,
      "t": 1.0,
      "visible": true,
      "x": 150,
      "y": 162,
      "w": 103,
      "h": 103,
      "scale": 1.0,
      "rotation": 0.0,
      "opacity": 1.0,
      "anchor": [
        51.047,
        51.21
      ],
      "asset": "objects/object_0/cutouts/cutout_000013.png",
      "mask": "masks/object_0/mask_000013.png",
      "centroid": [
        201.04666666666665,
        213.2102657004831
      ],
      "sprite": {
        "x": 515,
        "y": 103,
        "w": 103,
        "h": 103
      }
    },
    {
      "frame": 14,
      "sourceFrameIndex": 26,
      "t": 1.083333,
      "visible": true,
      "x": 160,
      "y": 154,
      "w": 103,
      "h": 103,
      "scale": 1.0,
      "rotation": 0.0,
      "opacity": 1.0,
      "anchor": [
        51.29,
        50.997
      ],
      "asset": "objects/object_0/cutouts/cutout_000014.png",
      "mask": "masks/object_0/mask_000014.png",
      "centroid": [
        211.2901749464826,
        204.99729337368666
      ],
      "sprite": {
        "x": 618,
        "y": 103,
        "w": 103,
        "h": 103
      }
    },
    {
      "frame": 15,
      "sourceFrameIndex": 28,
      "t": 1.166667,
      "visible": true,
      "x": 171,
      "y": 145,
      "w": 102,
      "h": 103,
      "scale": 1.0,
      "rotation": 0.0,
      "opacity": 1.0,
      "anchor": [
        49.861,
        50.94
      ],
      "asset": "objects/object_0/cutouts/cutout_000015.png",
      "mask": "masks/object_0/mask_000015.png",
      "centroid": [
        220.8605931989288,
        195.93977060279923
      ],
      "sprite": {
        "x": 0,
        "y": 206,
        "w": 102,
        "h": 103
      }
    },
    {
      "frame": 16,
      "sourceFrameIndex": 30,
      "t": 1.25,
      "visible": true,
      "x": 180,
      "y": 136,
      "w": 103,
      "h": 103,
      "scale": 1.0,
      "rotation": 0.0,
      "opacity": 1.0,
      "anchor": [
        50.979,
        51.204
      ],
      "asset": "objects/object_0/cutouts/cutout_000016.png",
      "mask": "masks/object_0/mask_000016.png",
      "centroid": [
        230.97902327105865,
        187.20411970854448
      ],
      "sprite": {
        "x": 103,
        "y": 206,
        "w": 103,
        "h": 103
      }
    },
    {
      "frame": 17,
      "sourceFrameIndex": 32,
      "t": 1.333333,
      "visible": true,
      "x": 190,
      "y": 126,
      "w": 103,
      "h": 103,
      "scale": 1.0,
      "rotation": 0.0,
      "opacity": 1.0,
      "anchor": [
        50.975,
        50.364
      ],
      "asset": "objects/object_0/cutouts/cutout_000017.png",
      "mask": "masks/object_0/mask_000017.png",
      "centroid": [
        240.9753839894212,
        176.36417963584577
      ],
      "sprite": {
        "x": 206,
        "y": 206,
        "w": 103,
        "h": 103
      }
    },
    {
      "frame": 18,
      "sourceFrameIndex": 34,